{"$defs":{"binding":{"additionalProperties":false,"properties":{"content_hash":{"$ref":"#/$defs/sha256"},"id":{"$ref":"#/$defs/id"},"revision":{"$ref":"#/$defs/revision"}},"required":["id","revision","content_hash"],"type":"object"},"capabilities":{"items":{"$ref":"#/$defs/capability"},"maxItems":64,"type":"array","uniqueItems":true},"capability":{"enum":["project.read","artifact.read","artifact.propose","tool.invoke","memory.read","memory.propose"]},"id":{"maxLength":64,"minLength":2,"pattern":"^[a-z][a-z0-9_]{1,63}$","type":"string"},"identity":{"additionalProperties":false,"properties":{"content_hash":{"$ref":"#/$defs/sha256"},"id":{"$ref":"#/$defs/id"}},"required":["id","content_hash"],"type":"object"},"revision":{"maximum":9007199254740991,"minimum":1,"type":"integer"},"sha256":{"pattern":"^[0-9a-f]{64}$","type":"string"},"tools":{"items":{"maxLength":1024,"pattern":"^[a-z][a-z0-9_]{1,63}(?:\\.[a-z][a-z0-9_]{1,63})+$","type":"string"},"maxItems":64,"type":"array","uniqueItems":true},"work_order":{"additionalProperties":false,"properties":{"capability_ids":{"$ref":"#/$defs/capabilities"},"content_hash":{"$ref":"#/$defs/sha256"},"id":{"$ref":"#/$defs/id"},"revision":{"$ref":"#/$defs/revision"},"tool_ids":{"$ref":"#/$defs/tools"}},"required":["id","revision","content_hash","capability_ids","tool_ids"],"type":"object"}},"$id":"https://world-forge.local/schemas/agent-capability-grant.schema.json","$schema":"https://json-schema.org/draft/2020-12/schema","additionalProperties":false,"properties":{"activation":{"$ref":"#/$defs/identity"},"content_hash":{"$ref":"#/$defs/sha256"},"effective_capability_ids":{"$ref":"#/$defs/capabilities"},"effective_tool_ids":{"$ref":"#/$defs/tools"},"execution_id":{"$ref":"#/$defs/id"},"format":{"const":"world-forge.agent_capability_grant"},"format_version":{"const":1},"grant_id":{"$ref":"#/$defs/id"},"policy":{"additionalProperties":false,"properties":{"capability_ids":{"$ref":"#/$defs/capabilities"},"tool_ids":{"$ref":"#/$defs/tools"}},"required":["capability_ids","tool_ids"],"type":"object"},"role":{"$ref":"#/$defs/binding"},"role_capability_ids":{"$ref":"#/$defs/capabilities"},"role_tool_ids":{"$ref":"#/$defs/tools"},"runtime":{"$ref":"#/$defs/binding"},"work_order":{"$ref":"#/$defs/work_order"}},"required":["format","format_version","grant_id","execution_id","activation","role","work_order","runtime","policy","role_capability_ids","role_tool_ids","effective_capability_ids","effective_tool_ids","content_hash"],"title":"Immutable Agent Capability Grant v1","type":"object","x-world-forge-agent-harness-coherent":true}
