{"activation":{"content_hash":"69fe43c3662aa6e984f97160d23f8217e9f7428bbc8dc5af04326c189bed79ce","id":"activation_01"},"content_hash":"530b45d0edc29fdd98430e3f972f6f43b8be406cb0aca8fb92004a19595c4e22","effective_capability_ids":["artifact.read","project.read","tool.invoke"],"effective_tool_ids":["source.read","world.validate"],"execution_id":"execution_01","format":"world-forge.agent_capability_grant","format_version":1,"grant_id":"grant_01","policy":{"capability_ids":["artifact.read","project.read","tool.invoke"],"tool_ids":["source.read","world.validate"]},"role":{"content_hash":"1111111111111111111111111111111111111111111111111111111111111111","id":"author","revision":1},"role_capability_ids":["artifact.read","project.read","tool.invoke"],"role_tool_ids":["source.read","world.validate"],"runtime":{"content_hash":"3333333333333333333333333333333333333333333333333333333333333333","id":"harness_runtime","revision":1},"work_order":{"capability_ids":["artifact.read","project.read","tool.invoke"],"content_hash":"2222222222222222222222222222222222222222222222222222222222222222","id":"work_order_01","revision":1,"tool_ids":["source.read","world.validate"]}}